{"schema_version": "1.0", "kind": "editorial_plan", "status": "completed", "editorial_plan_id": "edp_65cf16010bef6c2074f130e1_approved", "editorial_cache_key": "da03827734b97c5ee1fb19f887bbc4987f2057d94348b02d71f7a1c0eb89ac30", "pipeline_version": "approved-content-neutral-1.0", "input": {"knowledge_graph_sha256": "5817c87d15d1f5cc0476ba7ce555b396249e8969c60d828f740945f30fa4c2e0", "knowledge_gate_sha256": "f1b82ea2550ba60aa05184e0a61c5169e1195c19b788919418a4ab6f0e5ab428", "knowledge_base_sha256": "3a2d779e5957422c97ed17fa36313fd71cb0d0487dca48c532062aa167767d26", "audio_sha256": "010396e67ef47bb403acf057a8d34e06cb7999d6b795a5cd6dd8d6e55604ef81", "episode_metadata_sha256": "530bc2c07ce4c8d7ef085723994d31e60c5a2182a836bff0191fb182461bbdb6"}, "execution": {"kind": "current_skill_execution_model", "model_id": null, "runtime_id": null, "identity_status": "not_exposed_by_host"}, "policy": {"focus": null, "audience": null, "max_deep_dive_pages": null, "output_language": "zh-CN", "selection_policy_version": "approved-content-neutral-1.0"}, "package": {"package_thesis": {"statement": "情绪不是被外界触发、写在脸上和脑区里的固定反应，而是大脑这台预测机器根据过往概念和当下情境，对身体内部感受（内感受）做出的预测；正因为是构建出来的，我们可以通过照顾身体预算、区分身与心、学习新概念和词汇来重新构建情绪——做自己情绪的建筑师。", "epistemic_status": "episode_synthesis", "derived_from_ids": ["clm_episode_thesis"], "evidence_anchor_ids": ["ea_01_01", "ea_01_02", "ea_01_03", "ea_02_01", "ea_02_02", "ea_02_03", "ea_02_04", "ea_02_05", "ea_03_01", "ea_03_02", "ea_03_03", "ea_03_04", "ea_03_05", "ea_04_01", "ea_04_02", "ea_04_03", "ea_05_01", "ea_05_02", "ea_05_03", "ea_05_04", "ea_05_05", "ea_06_01", "ea_06_02", "ea_06_03", "ea_06_04", "ea_06_05", "ea_06_06", "ea_07_01", "ea_07_02", "ea_07_03", "ea_07_04", "ea_07_05", "ea_07_06", "ea_08_01", "ea_08_02", "ea_08_03", "ea_08_04", "ea_08_05", "ea_08_06", "ea_09_01", "ea_09_02", "ea_09_03", "ea_09_04", "ea_10_01", "ea_10_02", "ea_10_03", "ea_10_04", "ea_10_05", "ea_11_01", "ea_11_02", "ea_11_03", "ea_11_04", "ea_12_01", "ea_12_02", "ea_12_03", "ea_12_04", "ea_12_05", "ea_12_06", "ea_13_01", "ea_13_02", "ea_13_03", "ea_13_04", "ea_14_01", "ea_14_02", "ea_14_03", "ea_14_04", "ea_14_05", "ea_14_06", "ea_15_01", "ea_15_02", "ea_15_03", "ea_15_04", "ea_15_05", "ea_15_06", "ea_16_01", "ea_16_02", "ea_16_03", "ea_17_01", "ea_17_02", "ea_17_03", "ea_17_04", "ea_17_05", "ea_17_06", "ea_18_01", "ea_18_02", "ea_18_03", "ea_18_04", "ea_18_05", "ea_18_06", "ea_19_01", "ea_19_02", "ea_19_03", "ea_19_04", "ea_20_01", "ea_20_02", "ea_20_03", "ea_20_04", "ea_20_05", "ea_20_06", "ea_20_07", "ea_21_01", "ea_21_02", "ea_21_03", "ea_21_04", "ea_21_05", "ea_22_01", "ea_22_02", "ea_22_03", "ea_22_04", "ea_22_05", "ea_22_06", "ea_22_07", "ea_23_01", "ea_23_02", "ea_23_03", "ea_23_04", "ea_23_05", "ea_23_06", "ea_24_01", "ea_24_02", "ea_24_03", "ea_24_04", "ea_24_05", "ea_25_01", "ea_25_02", "ea_25_03", "ea_25_04", "ea_25_05", "ea_25_06", "ea_26_01", "ea_26_02", "ea_26_03", "ea_26_04", "ea_26_05", "ea_26_06", "ea_26_07", "ea_26_08", "ea_27_01", "ea_27_02", "ea_27_03", "ea_27_04", "ea_27_05", "ea_27_06", "ea_27_07", "ea_28_01", "ea_28_02", "ea_28_03", "ea_28_04", "ea_28_05", "ea_29_01", "ea_29_02", "ea_29_03", "ea_29_04", "ea_30_01", "ea_30_02", "ea_30_03", "ea_30_04", "ea_30_05", "ea_30_06", "ea_30_07", "ea_30_08", "ea_31_01", "ea_31_02", "ea_31_03", "ea_31_04", "ea_31_05", "ea_32_01", "ea_32_02", "ea_32_03", "ea_32_04", "ea_33_01", "ea_33_02", "ea_33_03", "ea_33_04", "ea_33_05", "ea_33_06", "ea_33_07", "ea_33_08"], "confidence": "medium", "uncertainty": "已批准的节目级综合判断；不把未证实的关系表述为普遍事实。"}, "cover": {"page_id": "edp_cover_65cf16010bef6c2074f130e1", "display_order": 0, "role": "package_entry", "title": "EP40《情绪》：如何精神稳定地「发疯」", "subtitle": "情绪不是被触发的，是被构建的", "derived_from_ids": ["clm_mod_01", "clm_mod_02", "clm_mod_03", "clm_mod_04", "clm_mod_05", "clm_mod_06", "clm_mod_07", "clm_mod_08"], "evidence_anchor_ids": ["ea_01_01", "ea_01_02", "ea_01_03", "ea_02_01", "ea_02_02", "ea_02_03", "ea_02_04", "ea_02_05", "ea_03_01", "ea_03_02", "ea_03_03", "ea_03_04", "ea_03_05", "ea_04_01", "ea_04_02", "ea_04_03", "ea_05_01", "ea_05_02", "ea_05_03", "ea_05_04", "ea_05_05", "ea_06_01", "ea_06_02", "ea_06_03", "ea_06_04", "ea_06_05", "ea_06_06", "ea_07_01", "ea_07_02", "ea_07_03", "ea_07_04", "ea_07_05", "ea_07_06", "ea_08_01", "ea_08_02", "ea_08_03", "ea_08_04", "ea_08_05", "ea_08_06", "ea_09_01", "ea_09_02", "ea_09_03", "ea_09_04", "ea_10_01", "ea_10_02", "ea_10_03", "ea_10_04", "ea_10_05", "ea_11_01", "ea_11_02", "ea_11_03", "ea_11_04", "ea_12_01", "ea_12_02", "ea_12_03", "ea_12_04", "ea_12_05", "ea_12_06", "ea_13_01", "ea_13_02", "ea_13_03", "ea_13_04", "ea_14_01", "ea_14_02", "ea_14_03", "ea_14_04", "ea_14_05", "ea_14_06", "ea_15_01", "ea_15_02", "ea_15_03", "ea_15_04", "ea_15_05", "ea_15_06", "ea_16_01", "ea_16_02", "ea_16_03", "ea_17_01", "ea_17_02", "ea_17_03", "ea_17_04", "ea_17_05", "ea_17_06", "ea_18_01", "ea_18_02", "ea_18_03", "ea_18_04", "ea_18_05", "ea_18_06", "ea_19_01", "ea_19_02", "ea_19_03", "ea_19_04", "ea_20_01", "ea_20_02", "ea_20_03", "ea_20_04", "ea_20_05", "ea_20_06", "ea_20_07", "ea_21_01", "ea_21_02", "ea_21_03", "ea_21_04", "ea_21_05", "ea_22_01", "ea_22_02", "ea_22_03", "ea_22_04", "ea_22_05", "ea_22_06", "ea_22_07", "ea_23_01", "ea_23_02", "ea_23_03", "ea_23_04", "ea_23_05", "ea_23_06", "ea_24_01", "ea_24_02", "ea_24_03", "ea_24_04", "ea_24_05", "ea_25_01", "ea_25_02", "ea_25_03", "ea_25_04", "ea_25_05", "ea_25_06", "ea_26_01", "ea_26_02", "ea_26_03", "ea_26_04", "ea_26_05", "ea_26_06", "ea_26_07", "ea_26_08", "ea_27_01", "ea_27_02", "ea_27_03", "ea_27_04", "ea_27_05", "ea_27_06", "ea_27_07", "ea_28_01", "ea_28_02", "ea_28_03", "ea_28_04", "ea_28_05", "ea_29_01", "ea_29_02", "ea_29_03", "ea_29_04", "ea_30_01", "ea_30_02", "ea_30_03", "ea_30_04", "ea_30_05", "ea_30_06", "ea_30_07", "ea_30_08", "ea_31_01", "ea_31_02", "ea_31_03", "ea_31_04", "ea_31_05", "ea_32_01", "ea_32_02", "ea_32_03", "ea_32_04", "ea_33_01", "ea_33_02", "ea_33_03", "ea_33_04", "ea_33_05", "ea_33_06", "ea_33_07", "ea_33_08"], "epistemic_status": "episode_synthesis", "confidence": "medium", "uncertainty": "原标题保留完整；副标题是已批准编辑提炼。"}, "overview": {"page_id": "edp_overview_65cf16010bef6c2074f130e1", "display_order": 1, "role": "whole_picture", "page_question": "情绪到底是什么、怎么来的，我们能拿它怎么办？", "takeaway": "情绪是大脑对身体感受的预测，是被构建出来的，所以可以重新构建。", "mental_model_statement": "没听过节目的读者读完能说出：旧的“情绪指纹”观被推翻了；大脑靠预测运作（体验盲区、内感受、预测/误差、身体预算）；情绪就是对内感受的预测，所以由概念塑造、随情境变化、没有标准模板；日常可以用主播的五步重新构建情绪，长期预算失衡与身心健康相关；以及这些说法的边界。", "model_components": [{"id": "omc_1_1", "role": "question", "knowledge_ids": ["mech_det_16_01", "clm_det_16_02", "mech_det_16_03"], "evidence_anchor_ids": ["ea_16_01", "ea_16_02", "ea_16_03"], "statement": "整期问题：情绪到底是什么、怎么来的，我们能拿它怎么办？"}, {"id": "omc_1_2", "role": "judgment", "knowledge_ids": ["clm_det_02_01", "clm_det_02_03", "mech_det_03_03", "bnd_det_03_05", "mech_det_04_02", "clm_det_04_03", "mech_det_05_04", "mech_det_08_01", "clm_det_08_06", "bnd_det_09_04"], "evidence_anchor_ids": ["ea_02_01", "ea_02_03", "ea_03_03", "ea_03_05", "ea_04_02", "ea_04_03", "ea_05_04", "ea_08_01", "ea_08_06", "ea_09_04"], "statement": "旧观念被推翻：情绪不是“刺激→固定表情/脑区”的指纹反应——情境实验与4个元分析都找不到指纹，人们其实靠上下文判断情绪"}, {"id": "omc_1_3", "role": "process", "knowledge_ids": ["mech_det_10_04", "clm_det_11_01", "mech_det_11_02", "clm_det_11_03", "mech_det_11_04", "mech_det_12_02", "clm_det_14_02", "mech_det_14_03", "mech_det_14_04", "mech_det_14_06", "mech_det_15_01", "mech_det_15_02"], "evidence_anchor_ids": ["ea_10_04", "ea_11_01", "ea_11_02", "ea_11_03", "ea_11_04", "ea_12_02", "ea_14_02", "ea_14_03", "ea_14_04", "ea_14_06", "ea_15_01", "ea_15_02"], "statement": "大脑是预测机器（四个概念）：①没有概念的信息落入体验盲区 ②身体内部被综合感知为内感受（好/不好×紧张/平静）③预测被证实就不再看输入，预测误差才带来学习 ④每次预测都先调动身体预算，能量在确认前就花出去了"}, {"id": "omc_1_4", "role": "judgment", "knowledge_ids": ["mech_det_16_01", "clm_det_16_02", "mech_det_16_03", "mech_det_17_04", "clm_det_17_06", "mech_det_18_04", "clm_det_19_03", "clm_det_25_03", "mech_det_25_04", "clm_det_25_05"], "evidence_anchor_ids": ["ea_16_01", "ea_16_02", "ea_16_03", "ea_17_04", "ea_17_06", "ea_18_04", "ea_19_03", "ea_25_03", "ea_25_04", "ea_25_05"], "statement": "核心：情绪是大脑用过往概念、结合当下情境，对内感受做出的预测。所以它①由概念塑造 ②随情境与目的变化（同样的胃痛可以是饿或恶心）③没有标准模板（快乐也有高唤醒和低唤醒）"}, {"id": "omc_1_5", "role": "practice", "knowledge_ids": ["bnd_det_20_01", "clm_det_20_07", "mech_det_22_02", "bnd_det_22_07", "clm_det_23_02", "mech_det_24_01", "clm_det_13_03", "clm_det_13_04"], "evidence_anchor_ids": ["ea_20_01", "ea_20_07", "ea_22_02", "ea_22_07", "ea_23_02", "ea_24_01", "ea_13_03", "ea_13_04"], "statement": "落地·主播五步（主播总结）：身心分离先查身体 → 身体预算协调 → 增加概念与正面经历 → 超量准备＋自我说服 → 同步上下文、扩充情绪词汇"}, {"id": "omc_1_6", "role": "practice", "knowledge_ids": ["mech_det_28_01", "mech_det_28_02", "mech_det_28_03", "clm_det_28_05", "mech_det_30_01", "mech_det_30_02", "mech_det_30_03", "mech_det_30_05", "clm_det_31_01", "clm_det_31_03", "clm_det_31_05"], "evidence_anchor_ids": ["ea_28_01", "ea_28_02", "ea_28_03", "ea_28_05", "ea_30_01", "ea_30_02", "ea_30_03", "ea_30_05", "ea_31_01", "ea_31_03", "ea_31_05"], "statement": "延伸·身心健康：长期预测出错→身体预算赤字→炎症恶性循环；抑郁像困在过去、焦虑像困在未来（作者推测）；最基本的是吃好睡好、社交、多运动"}, {"id": "omc_1_7", "role": "new_context", "knowledge_ids": ["clm_det_26_02", "bnd_det_26_05", "mech_det_26_07", "clm_det_27_01", "clm_det_27_04", "clm_det_27_05", "clm_det_27_06", "bnd_det_27_07"], "evidence_anchor_ids": ["ea_26_02", "ea_26_05", "ea_26_07", "ea_27_01", "ea_27_04", "ea_27_05", "ea_27_06", "ea_27_07"], "statement": "平行一句：社会文化同样参与构建情绪；改变情绪的责任在自己"}, {"id": "omc_1_8", "role": "boundary", "knowledge_ids": ["bnd_det_20_01", "clm_det_20_07", "mech_det_30_01", "mech_det_30_02", "mech_det_30_03", "mech_det_30_05"], "evidence_anchor_ids": ["ea_20_01", "ea_20_07", "ea_30_01", "ea_30_02", "ea_30_03", "ea_30_05"], "statement": "边界：情绪不是“假的”，也不是想控制就能控制；五步是主播经验，疾病部分不是医疗建议"}, {"id": "omc_1_9", "role": "conclusion", "knowledge_ids": ["clm_det_32_01", "clm_det_32_02", "clm_det_32_03", "bnd_det_32_04"], "evidence_anchor_ids": ["ea_32_01", "ea_32_02", "ea_32_03", "ea_32_04"], "statement": "结论：我们是自己情绪的建筑师"}